race,es,ts,sh,un,total,race2,pit_percent,pop,pop_percent,rdi
"American Indian, Alaska Native, or Indigenous",2,0,0,0,2,aian,0.7518796992481203,579,0.224925995851106,3.3427870193618756
Asian or Asian American,1,0,0,0,1,asian,0.37593984962406013,10446,4.057991282660886,0.09264185737174642
"Black, African American, or African",105,4,0,8,117,black,43.984962406015036,30292,11.767630857205011,3.737792503839819
Native Hawaiian or Pacific Islander,0,0,0,0,0,nhpi,0,106,0.041178161589321645,0
White,116,5,0,16,137,white,51.50375939849624,201013,78.08816788258785,0.6595590701517865
Multiple Races,7,0,0,2,9,multi,3.3834586466165413,11223,4.359834976575065,0.7760519984805638
